{
  "morphology": "biped",
  "points": [
    {"name": "pelvis", "kind": "pivot", "x": 80, "y": 126, "confidence": 0.52, "note": "Root inferred beneath the waistband; trouser volume obscures the pelvis."},
    {"name": "chest", "kind": "anchor", "x": 80, "y": 91, "confidence": 0.84, "note": "Central upper-torso anchor estimated from the blouse silhouette."},
    {"name": "neck", "kind": "joint", "x": 80, "y": 70, "confidence": 0.9, "note": "Visible neck base between the collar and head."},
    {"name": "head_center", "kind": "pivot", "x": 80, "y": 51, "confidence": 0.96, "note": "Center of the face and head mass."},
    {"name": "head_top", "kind": "anchor", "x": 80, "y": 31, "confidence": 0.93, "note": "Top of the hair silhouette."},
    {"name": "shoulder_r", "kind": "joint", "x": 62, "y": 76, "confidence": 0.74, "note": "Anatomical right shoulder, on the viewer's left; partly softened by the puffed sleeve."},
    {"name": "elbow_r", "kind": "joint", "x": 54, "y": 105, "confidence": 0.43, "note": "Anatomical right elbow inferred inside the wide sleeve."},
    {"name": "wrist_r", "kind": "joint", "x": 53, "y": 126, "confidence": 0.76, "note": "Visible transition from the right sleeve cuff to the hand."},
    {"name": "hand_tip_r", "kind": "anchor", "x": 52, "y": 143, "confidence": 0.83, "note": "Lowest visible point of the anatomical right hand."},
    {"name": "shoulder_l", "kind": "joint", "x": 98, "y": 76, "confidence": 0.74, "note": "Anatomical left shoulder, on the viewer's right; partly softened by the puffed sleeve."},
    {"name": "elbow_l", "kind": "joint", "x": 106, "y": 105, "confidence": 0.43, "note": "Anatomical left elbow inferred inside the wide sleeve."},
    {"name": "wrist_l", "kind": "joint", "x": 108, "y": 125, "confidence": 0.76, "note": "Visible transition from the left sleeve cuff to the hand."},
    {"name": "hand_tip_l", "kind": "anchor", "x": 109, "y": 142, "confidence": 0.83, "note": "Lowest visible point of the anatomical left hand."},
    {"name": "hip_r", "kind": "joint", "x": 68, "y": 129, "confidence": 0.41, "note": "Anatomical right hip inferred beneath the waistband and wide trousers."},
    {"name": "knee_r", "kind": "joint", "x": 66, "y": 169, "confidence": 0.25, "note": "Highly uncertain anatomical right knee; the wide trouser leg conceals articulation."},
    {"name": "ankle_r", "kind": "joint", "x": 66, "y": 204, "confidence": 0.55, "note": "Anatomical right ankle inferred where the trouser hem meets the shoe."},
    {"name": "toe_r", "kind": "anchor", "x": 68, "y": 214, "confidence": 0.82, "note": "Center-front of the anatomical right shoe."},
    {"name": "sole_r", "kind": "contact", "x": 67, "y": 219, "confidence": 0.91, "note": "Planted anatomical right foot contact at the visible sole."},
    {"name": "hip_l", "kind": "joint", "x": 92, "y": 129, "confidence": 0.41, "note": "Anatomical left hip inferred beneath the waistband and wide trousers."},
    {"name": "knee_l", "kind": "joint", "x": 95, "y": 169, "confidence": 0.25, "note": "Highly uncertain anatomical left knee; the wide trouser leg conceals articulation."},
    {"name": "ankle_l", "kind": "joint", "x": 97, "y": 205, "confidence": 0.55, "note": "Anatomical left ankle inferred where the trouser hem meets the shoe."},
    {"name": "toe_l", "kind": "anchor", "x": 99, "y": 215, "confidence": 0.82, "note": "Center-front of the anatomical left shoe."},
    {"name": "sole_l", "kind": "contact", "x": 99, "y": 220, "confidence": 0.91, "note": "Planted anatomical left foot contact at the visible sole."}
  ],
  "bones": [
    {"name": "spine", "start": "pelvis", "end": "chest", "radius": 16, "parent": null, "z": 0},
    {"name": "upper_torso", "start": "chest", "end": "neck", "radius": 13, "parent": "spine", "z": 0},
    {"name": "head", "start": "neck", "end": "head_center", "radius": 13, "parent": "upper_torso", "z": 0},
    {"name": "clavicle_r", "start": "chest", "end": "shoulder_r", "radius": 8, "parent": "upper_torso", "z": 1},
    {"name": "upper_arm_r", "start": "shoulder_r", "end": "elbow_r", "radius": 7, "parent": "clavicle_r", "z": 1},
    {"name": "forearm_r", "start": "elbow_r", "end": "wrist_r", "radius": 5, "parent": "upper_arm_r", "z": 1},
    {"name": "hand_r", "start": "wrist_r", "end": "hand_tip_r", "radius": 4, "parent": "forearm_r", "z": 1},
    {"name": "clavicle_l", "start": "chest", "end": "shoulder_l", "radius": 8, "parent": "upper_torso", "z": 3},
    {"name": "upper_arm_l", "start": "shoulder_l", "end": "elbow_l", "radius": 7, "parent": "clavicle_l", "z": 3},
    {"name": "forearm_l", "start": "elbow_l", "end": "wrist_l", "radius": 5, "parent": "upper_arm_l", "z": 3},
    {"name": "hand_l", "start": "wrist_l", "end": "hand_tip_l", "radius": 4, "parent": "forearm_l", "z": 3},
    {"name": "pelvis_r", "start": "pelvis", "end": "hip_r", "radius": 11, "parent": "spine", "z": 0},
    {"name": "thigh_r", "start": "hip_r", "end": "knee_r", "radius": 14, "parent": "pelvis_r", "z": 0},
    {"name": "shin_r", "start": "knee_r", "end": "ankle_r", "radius": 13, "parent": "thigh_r", "z": 0},
    {"name": "foot_r", "start": "ankle_r", "end": "toe_r", "radius": 8, "parent": "shin_r", "z": 0},
    {"name": "pelvis_l", "start": "pelvis", "end": "hip_l", "radius": 11, "parent": "spine", "z": 2},
    {"name": "thigh_l", "start": "hip_l", "end": "knee_l", "radius": 14, "parent": "pelvis_l", "z": 2},
    {"name": "shin_l", "start": "knee_l", "end": "ankle_l", "radius": 13, "parent": "thigh_l", "z": 2},
    {"name": "foot_l", "start": "ankle_l", "end": "toe_l", "radius": 8, "parent": "shin_l", "z": 2}
  ],
  "frames": [
    {
      "phase": "idle_mid_a", "rootDx": 0, "rootDy": 0,
      "transforms": [
        {"bone": "upper_torso", "rotate": 0, "dx": 0, "dy": 0, "scaleX": 1, "scaleY": 1},
        {"bone": "head", "rotate": 0, "dx": 0, "dy": 0, "scaleX": 1, "scaleY": 1},
        {"bone": "upper_arm_r", "rotate": 0, "dx": 0, "dy": 0, "scaleX": 1, "scaleY": 1},
        {"bone": "forearm_r", "rotate": 0, "dx": 0, "dy": 0, "scaleX": 1, "scaleY": 1},
        {"bone": "upper_arm_l", "rotate": 0, "dx": 0, "dy": 0, "scaleX": 1, "scaleY": 1},
        {"bone": "forearm_l", "rotate": 0, "dx": 0, "dy": 0, "scaleX": 1, "scaleY": 1}
      ],
      "contacts": [{"bone": "foot_r", "x": 67, "y": 219, "bend": -1}, {"bone": "foot_l", "x": 99, "y": 220, "bend": 1}]
    },
    {
      "phase": "idle_inhale", "rootDx": 0, "rootDy": -1,
      "transforms": [
        {"bone": "upper_torso", "rotate": -0.2, "dx": 0, "dy": 0, "scaleX": 1.004, "scaleY": 1.002},
        {"bone": "head", "rotate": 0.3, "dx": 0, "dy": 0, "scaleX": 1, "scaleY": 1},
        {"bone": "upper_arm_r", "rotate": 0.3, "dx": 0, "dy": 0, "scaleX": 1, "scaleY": 1},
        {"bone": "forearm_r", "rotate": -0.15, "dx": 0, "dy": 0, "scaleX": 1, "scaleY": 1},
        {"bone": "upper_arm_l", "rotate": -0.3, "dx": 0, "dy": 0, "scaleX": 1, "scaleY": 1},
        {"bone": "forearm_l", "rotate": 0.15, "dx": 0, "dy": 0, "scaleX": 1, "scaleY": 1}
      ],
      "contacts": [{"bone": "foot_r", "x": 67, "y": 219, "bend": -1}, {"bone": "foot_l", "x": 99, "y": 220, "bend": 1}]
    },
    {
      "phase": "idle_mid_b", "rootDx": 0, "rootDy": 0,
      "transforms": [
        {"bone": "upper_torso", "rotate": 0, "dx": 0, "dy": 0, "scaleX": 1, "scaleY": 1},
        {"bone": "head", "rotate": 0, "dx": 0, "dy": 0, "scaleX": 1, "scaleY": 1},
        {"bone": "upper_arm_r", "rotate": 0, "dx": 0, "dy": 0, "scaleX": 1, "scaleY": 1},
        {"bone": "forearm_r", "rotate": 0, "dx": 0, "dy": 0, "scaleX": 1, "scaleY": 1},
        {"bone": "upper_arm_l", "rotate": 0, "dx": 0, "dy": 0, "scaleX": 1, "scaleY": 1},
        {"bone": "forearm_l", "rotate": 0, "dx": 0, "dy": 0, "scaleX": 1, "scaleY": 1}
      ],
      "contacts": [{"bone": "foot_r", "x": 67, "y": 219, "bend": -1}, {"bone": "foot_l", "x": 99, "y": 220, "bend": 1}]
    },
    {
      "phase": "idle_exhale", "rootDx": 0, "rootDy": 1,
      "transforms": [
        {"bone": "upper_torso", "rotate": 0.2, "dx": 0, "dy": 0, "scaleX": 0.998, "scaleY": 0.999},
        {"bone": "head", "rotate": -0.3, "dx": 0, "dy": 0, "scaleX": 1, "scaleY": 1},
        {"bone": "upper_arm_r", "rotate": -0.2, "dx": 0, "dy": 0, "scaleX": 1, "scaleY": 1},
        {"bone": "forearm_r", "rotate": 0.1, "dx": 0, "dy": 0, "scaleX": 1, "scaleY": 1},
        {"bone": "upper_arm_l", "rotate": 0.2, "dx": 0, "dy": 0, "scaleX": 1, "scaleY": 1},
        {"bone": "forearm_l", "rotate": -0.1, "dx": 0, "dy": 0, "scaleX": 1, "scaleY": 1}
      ],
      "contacts": [{"bone": "foot_r", "x": 67, "y": 219, "bend": -1}, {"bone": "foot_l", "x": 99, "y": 220, "bend": 1}]
    }
  ],
  "reasoning": "The rig follows the front-facing silhouette with anatomical left/right labels. Sleeve volume lowers elbow confidence, while the wide trousers make hip and knee positions substantially uncertain. Both sole contacts remain fixed in every frame; only a one-pixel vertical root cycle, sub-degree upper-body rotations, and minute torso scaling create a seamless breathing idle without disturbing the planted stance or facial identity. z values place the anatomical right side farther back, the body centrally, and the anatomical left side nearer."
}
